{
  "version": "1.0.0",
  "projectId": "demo-d3-intro",
  "scenes": [
    {
      "sceneId": "s01",
      "sceneNumber": 1,
      "narration": " ",
      "narration_tts": " ",
      "altText": "ReelForge 브랜드 인트로처럼 어두운 제작 공간에서 빛나는 로고 레일이 열리는 장면.",
      "layout": "quote",
      "mood": "dramatic",
      "reveal": "spotlight",
      "emphasis": "quote",
      "headline": "ReelForge",
      "items": [
        "한 줄이 영상이 된다",
        "렌더는 검증까지 마친다"
      ],
      "source": "ReelForge",
      "visual_kind": "generate_image",
      "imageAsset": {
        "prompt": "ReelForge brand intro mood, premium agency editing suite, dark cinematic control room, glowing review rails, confident product reveal without readable branding, no visible text, no letters, no numbers, no logos, no watermark",
        "placement": "fullscreen"
      },
      "kenBurns": {
        "enabled": true,
        "zoomFactor": 1.1,
        "zoomDirection": "in",
        "panDirection": "none"
      },
      "subtitleMode": "karaoke",
      "ost": 1
    },
    {
      "sceneId": "s02",
      "sceneNumber": 2,
      "narration": " ",
      "narration_tts": " ",
      "altText": "큰 30초 수치와 10컷 수치가 동시에 카운트업되며 쇼케이스 길이를 각인하는 장면.",
      "layout": "statistic",
      "mood": "triumphant",
      "reveal": "count_up",
      "emphasis": "number",
      "headline": "30초면 충분",
      "items": [
        "완성 영상"
      ],
      "values": [
        30
      ],
      "unit": "sec",
      "source": "ReelForge",
      "visual_kind": "chart",
      "kenBurns": {
        "enabled": true,
        "zoomFactor": 1.08,
        "zoomDirection": "in",
        "panDirection": "right"
      },
      "subtitleMode": "keyword"
    },
    {
      "sceneId": "s03",
      "sceneNumber": 3,
      "narration": " ",
      "narration_tts": " ",
      "altText": "한 줄 입력과 완성 영상이 양쪽 패널로 충돌하듯 비교되는 장면.",
      "layout": "compare",
      "mood": "urgent",
      "reveal": "split_reveal",
      "emphasis": "contrast",
      "headline": "한 줄 vs 30초",
      "items": [
        "한 줄 입력",
        "VFX 쇼케이스"
      ],
      "values": [
        "한 줄",
        "30초"
      ],
      "unit": "io",
      "source": "ReelForge",
      "visual_kind": "chart",
      "kenBurns": {
        "enabled": true,
        "zoomFactor": 1.07,
        "zoomDirection": "out",
        "panDirection": "left"
      },
      "subtitleMode": "karaoke"
    },
    {
      "sceneId": "s04",
      "sceneNumber": 4,
      "narration": " ",
      "narration_tts": " ",
      "altText": "브랜드 톤, 장면 계약, 검증 루프가 한 줄 슬로건처럼 연속 점등되는 장면.",
      "layout": "quote",
      "mood": "suspense",
      "reveal": "typewriter",
      "emphasis": "keyword",
      "headline": "톤·계약·검증",
      "items": [
        "톤은 브랜드에 맞추고",
        "씬은 계약으로 묶고",
        "검증은 루프가 돈다"
      ],
      "source": "ReelForge",
      "visual_kind": "none",
      "kenBurns": {
        "enabled": true,
        "zoomFactor": 1.05,
        "zoomDirection": "in",
        "panDirection": "up"
      },
      "subtitleMode": "keyword"
    },
    {
      "sceneId": "s05",
      "sceneNumber": 5,
      "narration": " ",
      "narration_tts": " ",
      "altText": "납품 전 품질 편차가 검수 레일에서 선명하게 정렬되는 장면.",
      "layout": "compare",
      "mood": "contemplative",
      "reveal": "split_reveal",
      "emphasis": "contrast",
      "headline": "반복은 자동 판단은 사람",
      "items": [
        "반복 편집",
        "품질 판단"
      ],
      "values": [
        "자동",
        "사람"
      ],
      "unit": "role",
      "source": "ReelForge",
      "visual_kind": "generate_image",
      "imageAsset": {
        "prompt": "ReelForge brand mood, premium quality review gate before delivery, abstract variance bands becoming clean aligned frames, agency-grade polish, no visible text, no letters, no numbers, no logos, no watermark",
        "placement": "background"
      },
      "kenBurns": {
        "enabled": true,
        "zoomFactor": 1.08,
        "zoomDirection": "in",
        "panDirection": "up"
      },
      "subtitleMode": "karaoke"
    },
    {
      "sceneId": "s06",
      "sceneNumber": 6,
      "narration": " ",
      "narration_tts": " ",
      "altText": "여덟 개 블록 표시가 빠르게 켜지고 마지막 값이 큰 숫자로 고정되는 장면.",
      "layout": "statistic",
      "mood": "dramatic",
      "reveal": "stagger_then_flash",
      "emphasis": "number",
      "headline": "블록 8·전환 6",
      "items": [
        "씬 블록",
        "전환"
      ],
      "values": [
        8,
        6
      ],
      "unit": "vfx",
      "source": "ReelForge",
      "visual_kind": "chart",
      "kenBurns": {
        "enabled": true,
        "zoomFactor": 1.09,
        "zoomDirection": "in",
        "panDirection": "none"
      },
      "subtitleMode": "keyword"
    },
    {
      "sceneId": "s07",
      "sceneNumber": 7,
      "narration": " ",
      "narration_tts": " ",
      "altText": "카피, 이미지, 블록, 렌더가 네 개의 몽타주 타일로 같은 박자에 맞춰 번쩍이는 장면.",
      "layout": "quote",
      "mood": "urgent",
      "reveal": "stagger_then_flash",
      "emphasis": "quote",
      "headline": "하이라이트 몽타주",
      "items": [
        "훅은 카피가",
        "리듬은 컷이",
        "마감은 렌더가"
      ],
      "source": "ReelForge",
      "visual_kind": "chart",
      "kenBurns": {
        "enabled": true,
        "zoomFactor": 1.06,
        "zoomDirection": "out",
        "panDirection": "right"
      },
      "subtitleMode": "karaoke"
    },
    {
      "sceneId": "s08",
      "sceneNumber": 8,
      "narration": " ",
      "narration_tts": " ",
      "altText": "TTS가 꺼진 상태와 BGM 중심 리듬이 비교되며 음악 레일만 살아 있는 장면.",
      "layout": "compare",
      "mood": "somber",
      "reveal": "parallel",
      "emphasis": "contrast",
      "headline": "말은 끄고 음악만",
      "items": [
        "나레이션",
        "배경음악"
      ],
      "values": [
        0,
        1
      ],
      "unit": "track",
      "source": "ReelForge",
      "visual_kind": "chart",
      "kenBurns": {
        "enabled": true,
        "zoomFactor": 1.04,
        "zoomDirection": "in",
        "panDirection": "down"
      },
      "subtitleMode": "keyword"
    },
    {
      "sceneId": "s09",
      "sceneNumber": 9,
      "narration": " ",
      "narration_tts": " ",
      "altText": "0개의 단어와 0개의 중복 headline 수치가 큰 통계로 고정되는 장면.",
      "layout": "statistic",
      "mood": "somber",
      "reveal": "count_up",
      "emphasis": "number",
      "headline": "프리셋 19종 내장",
      "items": [
        "내장 브랜드 프리셋"
      ],
      "values": [
        19
      ],
      "unit": "preset",
      "source": "ReelForge",
      "visual_kind": "generate_image",
      "kenBurns": {
        "enabled": true,
        "zoomFactor": 1.07,
        "zoomDirection": "out",
        "panDirection": "left"
      },
      "subtitleMode": "karaoke"
    },
    {
      "sceneId": "s10",
      "sceneNumber": 10,
      "narration": " ",
      "narration_tts": " ",
      "altText": "마지막 브랜드 카드가 어두운 배경 위에서 밝은 액센트 라인과 함께 고정되는 장면.",
      "layout": "quote",
      "mood": "triumphant",
      "reveal": "dramatic_pause",
      "emphasis": "quote",
      "headline": "말 대신 렌더",
      "items": [
        "말 대신 렌더로 보여준다",
        "좋았다면 스타 한 번"
      ],
      "source": "ReelForge",
      "visual_kind": "none",
      "kenBurns": {
        "enabled": true,
        "zoomFactor": 1.05,
        "zoomDirection": "in",
        "panDirection": "none"
      },
      "subtitleMode": "keyword"
    }
  ],
  "transitions": [
    {
      "from": "s01",
      "to": "s02",
      "type": "zoom-punch",
      "duration": 0.32
    },
    {
      "from": "s02",
      "to": "s03",
      "type": "push-wipe",
      "duration": 0.3
    },
    {
      "from": "s03",
      "to": "s04",
      "type": "cut",
      "duration": 0
    },
    {
      "from": "s04",
      "to": "s05",
      "type": "flash-cut",
      "duration": 0.2
    },
    {
      "from": "s05",
      "to": "s06",
      "type": "zoom-punch",
      "duration": 0.3
    },
    {
      "from": "s06",
      "to": "s07",
      "type": "cut",
      "duration": 0
    },
    {
      "from": "s07",
      "to": "s08",
      "type": "push-wipe-right",
      "duration": 0.3
    },
    {
      "from": "s08",
      "to": "s09",
      "type": "cut",
      "duration": 0
    },
    {
      "from": "s09",
      "to": "s10",
      "type": "zoom-punch",
      "duration": 0.3
    }
  ]
}
